{
  "snapshot_id": "00000000-0000-4000-8000-000000000001",
  "published_at": "2026-07-21T12:00:00Z",
  "data_through_label": "Data through FY2024 fixture filings",
  "entries": [
    {"org_id": "00000000-0000-4000-8000-000000000101", "slug": "millbrook-community-rowing", "display_name": "Millbrook Community Rowing", "aliases": ["Millbrook Rowing", "MCR"], "city": "Millbrook", "state": "MA", "org_type": "community_club", "program_mix": ["youth", "masters", "adaptive"], "peer_cohorts": [], "coverage_state": "990", "filing_years": [2020, 2021, 2022, 2023, 2024], "latest_tax_year": 2024, "latest_total_revenue": 640000, "fye_month": 6},
    {"org_id": "00000000-0000-4000-8000-000000000102", "slug": "cedar-point-barge-club", "display_name": "Cedar Point Barge Club", "aliases": ["Cedar Point Barge", "CPBC"], "city": "Cedar Point", "state": "OR", "org_type": "private_membership_club", "program_mix": ["masters", "recreational"], "peer_cohorts": [], "coverage_state": "990ez", "filing_years": [2022, 2023, 2024], "latest_tax_year": 2024, "latest_total_revenue": 87000, "fye_month": 10},
    {"org_id": "00000000-0000-4000-8000-000000000103", "slug": "larkspur-river-adaptive", "display_name": "Larkspur River Adaptive", "aliases": ["Larkspur Adaptive", "LRA"], "city": "Larkspur", "state": "CO", "org_type": "adaptive_program", "program_mix": ["adaptive", "youth"], "peer_cohorts": [], "coverage_state": "990n_only", "filing_years": [2022, 2023, 2024], "latest_tax_year": 2024, "latest_total_revenue": null, "fye_month": 12},
    {"org_id": "00000000-0000-4000-8000-000000000104", "slug": "harborview-scholastic-oars", "display_name": "Harborview Scholastic Oars", "aliases": ["Harborview Oars", "HSO"], "city": "Harborview", "state": "WA", "org_type": "scholastic_program", "program_mix": ["youth", "scholastic"], "peer_cohorts": [], "coverage_state": "990", "filing_years": [2020, 2022, 2023, 2024], "latest_tax_year": 2024, "latest_total_revenue": 310000, "fye_month": 6},
    {"org_id": "00000000-0000-4000-8000-000000000105", "slug": "pineglass-collegiate-club", "display_name": "Pineglass Collegiate Club", "aliases": ["Pineglass Crew", "PCC"], "city": "Pineglass", "state": "NY", "org_type": "collegiate_club", "program_mix": ["collegiate", "youth"], "peer_cohorts": [], "coverage_state": "990", "filing_years": [2020, 2021, 2022, 2023, 2024], "latest_tax_year": 2024, "latest_total_revenue": 455000, "fye_month": 10},
    {"org_id": "00000000-0000-4000-8000-000000000106", "slug": "northfield-masters-rowing", "display_name": "Northfield Masters Rowing", "aliases": ["Northfield Masters", "NMR"], "city": "Northfield", "state": "MN", "org_type": "community_club", "program_mix": ["masters", "recreational"], "peer_cohorts": [], "coverage_state": "990", "filing_years": [2022, 2023, 2024], "latest_tax_year": 2024, "latest_total_revenue": 515000, "fye_month": 12},
    {"org_id": "00000000-0000-4000-8000-000000000107", "slug": "blue-heron-community-oars", "display_name": "Blue Heron Community Oars", "aliases": ["Blue Heron Oars", "BHCO"], "city": "Blue Heron", "state": "VA", "org_type": "community_club", "program_mix": ["youth", "masters"], "peer_cohorts": [], "coverage_state": "990", "filing_years": [2022, 2023, 2024], "latest_tax_year": 2024, "latest_total_revenue": 225000, "fye_month": 6},
    {"org_id": "00000000-0000-4000-8000-000000000108", "slug": "juniper-creek-rowing", "display_name": "Juniper Creek Rowing", "aliases": ["Juniper Creek Boosters", "JCR"], "city": "Juniper Creek", "state": "NC", "org_type": "booster_club", "program_mix": ["youth", "scholastic"], "peer_cohorts": [], "coverage_state": "990", "filing_years": [2024], "latest_tax_year": 2024, "latest_total_revenue": 46000, "fye_month": 12},
    {"org_id": "00000000-0000-4000-8000-000000000109", "slug": "silverplain-river-collective", "display_name": "Silverplain River Collective", "aliases": ["Silverplain Athletic Association", "SRAC"], "city": "Silverplain", "state": "IL", "org_type": "association", "program_mix": ["masters", "open/elite"], "peer_cohorts": [], "coverage_state": "990", "filing_years": [2022, 2023, 2024], "latest_tax_year": 2024, "latest_total_revenue": 385000, "fye_month": 10},
    {"org_id": "00000000-0000-4000-8000-000000000110", "slug": "redstone-river-collective", "display_name": "Redstone River Collective", "aliases": ["Redstone River Club", "RRC"], "city": "Redstone", "state": "PA", "org_type": "private_membership_club", "program_mix": ["masters", "recreational"], "peer_cohorts": [], "coverage_state": "990", "filing_years": [2020, 2021, 2022, 2023, 2024], "latest_tax_year": 2024, "latest_total_revenue": 275000, "fye_month": 6},
    {"org_id": "00000000-0000-4000-8000-000000000111", "slug": "bayward-community-rowing", "display_name": "Bayward Community Rowing", "aliases": ["Bayward Rowing", "BCR"], "city": "Bayward", "state": "CT", "org_type": "community_club", "program_mix": ["youth", "masters", "adaptive"], "peer_cohorts": ["regional-community-sweep"], "coverage_state": "990", "filing_years": [2022, 2023, 2024], "latest_tax_year": 2024, "latest_total_revenue": 290000, "fye_month": 6},
    {"org_id": "00000000-0000-4000-8000-000000000112", "slug": "cobalt-reach-club", "display_name": "Cobalt Reach Club", "aliases": ["Cobalt Reach", "CRC"], "city": "Cobalt Reach", "state": "RI", "org_type": "community_club", "program_mix": ["masters", "open/elite"], "peer_cohorts": ["regional-community-sweep"], "coverage_state": "990", "filing_years": [2020, 2021, 2022, 2023, 2024], "latest_tax_year": 2024, "latest_total_revenue": 340000, "fye_month": 12}
  ]
}
